Place,Venues,Repertory
,,Been Here and Gone; Revelations; The Beloved; Roots of the Blues; Letter to a Lady
"Aarhus, Denmark",Musikhuset; Aarhus Teater,Gazelle; The Still Point; The Stack-Up; Night Creature; Anjour: Ruminations on Dudley; Cry; Love Songs; Fever Swamp; Treading; Fontessa and Friends; Night Shade; The Time Before the Time After (After the Time Before); Isba; Pigs and Fishes; Myth; Suite Otis; Sunrise... Sunset; Streams; Revelations; Divining; Toccata
"Abidjan, Côte d'Ivoire",Centre Culturel de Treichville; Hôtel Ivoire,Lament; Congo Tango Palace; Revelations; Metallics; Blues Suite
"Accra, Ghana",Art Centre,Lament; Congo Tango Palace; Revelations; Metallics; Blues Suite
"Addis Ababa, Ethiopia",Haile Selassie I Theatre,The Prodigal Prince; Reflections in D; Revelations; Blues Suite; Toccata
"Adelaide, Australia",Festival Theatre,Suite Otis; Memoria; Speeds; The Stack-Up; Night Creature; Revelations; Treading; Concerto in F; Divining; Cry
"Akron, OH, USA","Edwin J. Thomas Performing Arts Hall, University of Akron",The Lark Ascending; The Road of the Phoebe Snow; Carmina Burana; Streams; Revelations; Journey; How Long Have It Been; Love Songs
"Albany, NY, USA",Albany Mall,Revelations
"Albuquerque, NM, USA","Popejoy Hall, University of New Mexico",Streams; Night Creature; Revelations; Hidden Rites; After Eden; Kinetic Molpai; Cry; Love Songs
"Algiers, Algeria",Théâtre National Algérien,The Prodigal Prince; Icarus; Streams; Revelations; Journey; Dance for Six; Blues Suite; Toccata
"Allendale, MI, USA","Armstrong Theater, Grand Valley State",Blues Suite; Rainbow 'Round My Shoulder; Revelations
"Altoona, PA, USA",Roosevelt Junior High School Auditorium,Congo Tango Palace; Reflections in D; Revelations; Blues Suite; Toccata
"Ambler, PA, USA","Ambler Amphitheatre; Outdoor Concert Stage, Temple University",Suite Otis; Cry; The Lark Ascending; The Road of the Phoebe Snow; Gazelle; Liberian Suite; Icarus; Night Creature; Rainbow 'Round My Shoulder; Pas de Duke; Butterfly; Streams; Revelations; Hidden Rites; Passage; Blues Suite; Facets; Love Songs
"Ames, IA, USA","Iowa State University; C.Y. Stephens Auditorium, Iowa State Center, Iowa State University",Suite Otis; The Time Before the Time After (After the Time Before); Congo Tango Palace; Blues Suite; Reflections in D; The Stack-Up; Night Creature; Rainbow 'Round My Shoulder; Archipelago; Butterfly; Treading; Streams; Fontessa and Friends; Concerto in F; Revelations; Flowers; Cry; Toccata
"Amherst, MA, USA","Fine Arts Center Concert Hall, University of Massachusetts Amherst ; Bowker Auditorium, University of Massachusetts Amherst",Speeds; The Stack-Up; Night Creature; Butterfly; Divining; Mary Lou's Mass; Flowers; Cry; Love Songs; The Lark Ascending; The Road of the Phoebe Snow; Suspension; Treading; Tilt; Memoria; The Time Before the Time After (After the Time Before); Phases; Later That Day; Pigs and Fishes; Archipelago; Hobo Sapiens; Myth; Suite Otis; Liberian Suite; Bad Blood; Rainbow 'Round My Shoulder; Streams; Revelations; Les Noces; Hermit Songs; After Eden; Blues Suite
"Amsterdam, Netherlands",Rai Congress Center; Stadsschouwburg,The Prodigal Prince; The Stack-Up; Night Creature; Journey; The Black Belt; Cry; Lament; The Road of the Phoebe Snow; Treading; Credo; Concerto in F; Blues Suite; Icarus; Suite Otis; Congo Tango Palace; Bad Blood; Reflections in D; Streams; Revelations; Metallics; Caverna Magica; Toccata
"Anchorage, AK, USA","Evangeline Atwood Concert Hall, Alaska Center for the Performing Arts; West High Auditorium",Suite Otis; Cry; Shards; Phases; The Stack-Up; Night Creature; Streams; Revelations; Treading; Divining; Songs Without Words; Blues Suite; Love Songs
"Ann Arbor, MI, USA","Hill Auditorium, University of Michigan; Power Center for the Performing Arts, University of Michigan",Gazelle; The Still Point; Masekela Langage; Night Creature; Journey; How Long Have It Been; Butterfly; Mary Lou's Mass; Flowers; Kinetic Molpai; Cry; Love Songs; The Lark Ascending; Feast of Ashes; Treading; Tilt; Memoria; The Time Before the Time After (After the Time Before); Phases; Later That Day; The Wedding; Archipelago; Clear Songs After Rain; Nocturne; Portrait of Billie; Hobo Sapiens; Myth; Suite Otis; Crossword; Congo Tango Palace; Blood Memories; Countdown; The River; Reflections in D; Places; Rainbow 'Round My Shoulder; Streams; Revelations; Choros; Carmina Burana; Hidden Rites; Blues Suite; Toccata
"Antananarivo, Malagasy Republic",Cinema SOA,
"Antwerp, Belgium",Koninklijke Vlaamse Opera; Queen Elizabeth Hall,Suite Otis; Cry; Night Creature; Revelations; Treading; Concerto in F; Divining; Caverna Magica; Tilt
"Arles, France",Theatre Antique,Suite Otis; Myth; Night Creature; Streams; Revelations; Butterfly; Cry; Facets; Love Songs
"Arnhem, Netherlands",Stadsschouwburg,Lament; The Road of the Phoebe Snow; Congo Tango Palace; Reflections in D; Icarus; Revelations; Journey; Metallics; Toccata
"Asheville, NC, USA","Thomas Wolfe Auditorium, University of North Carolina Asheville",Love Songs; The Stack-Up; Blues Suite; Revelations
"Athens, Greece",Odeon of Herodes Atticus,Gazelle; Spectrum; The Still Point; Speeds; The Stack-Up; Night Creature; Butterfly; Cry; Love Songs; Treading; Fontessa and Friends; Concerto in F; Memoria; The Time Before the Time After (After the Time Before); Phases; Pigs and Fishes; Caverna Magica; Facets; Suite Otis; The River; Streams; Revelations; Blues Suite
"Athens, OH, USA","Memorial Auditorium, Ohio University",Congo Tango Palace; Reflections in D; Revelations; The Beloved; Blues Suite; Toccata
"Atlanta, GA, USA","Davage Auditorium, Clark College; Omni; Moorehouse University; Atlanta Civic Center; Spelman College; Fox Theatre",Gazelle; Spectrum; Masekela Langage; Speeds; Witness; The Mooche; The Stack-Up; Cinco Latinos; Night Creature; Butterfly; Divining; Flowers; Cry; Love Songs; District Storyville; Landscape; The Lark Ascending; The Road of the Phoebe Snow; Feast of Ashes; Fever Swamp; Treading; Fontessa and Friends; Survivors; Concerto in F; Blues Suite; For 'Bird' - With Love; Fire Sermon; Memoria; The Time Before the Time After (After the Time Before); Light; Phases; Isba; Later That Day; Pigs and Fishes; Hobo Sapiens; Facets; Suite Otis; Liberian Suite; Congo Tango Palace; Three Black Kings; Bad Blood; Reflections in D; Caravan; Rainbow 'Round My Shoulder; Streams; Revelations; Gillespiana; Les Noces; Inside; The Magic of Katherine Dunham; Hidden Rites; Pas de Duke; After Eden; Caverna Magica; Toccata
"Atlantic City, NJ, USA",Atlantic City High School Auditorium,Congo Tango Palace; Reflections in D; Revelations; Blues Suite; Toccata
"Austin, TX, USA","University of Texas at Austin; Performing Arts Concert Hall, University of Texas at Austin; Municipal Auditorium; The Texas Union, University of Texas Austin",The Still Point; Masekela Langage; The Stack-Up; Night Creature; Divining; Flowers; Cry; Love Songs; The Road of the Phoebe Snow; Feast of Ashes; Fever Swamp; Suspension; Treading; Fontessa and Friends; Concerto in F; Tilt; Phases; Rainbow 'Round My Shoulder; Streams; Revelations; After Eden
"Avignon, France",Cour d'Honneur du Palais des Papes,Cry; The Lark Ascending; Gazelle; The Mooche; Carmina Burana; Night Creature; Rainbow 'Round My Shoulder; Journey; Pas de Duke; Streams; Revelations; After Eden; Hobo Sapiens; Blues Suite; Facets; Love Songs
"Baalbek, Lebanon",Court of the Temple of Bacchus,The Lark Ascending; Blues Suite; Streams; Revelations; Hidden Rites; Kinetic Molpai; Cry
"Bacolod City, Philippines","Auditorium, The University of Negros Occidental",Mountainway Chant; Been Here and Gone; Cinco Latinos; Revelations; The Beloved
"Baldwin City, KS, USA",Baker University,
"Baltimore, MD, USA","Dalsheimer Auditorium, Baltimore Hebrew Congregation; Lyric Opera House; Coppin State College; Shriver Auditorium, Johns Hopkins University",Speeds; The Stack-Up; Night Creature; Cry; Love Songs; The Lark Ascending; Treading; Fontessa and Friends; Concerto in F; Survivors; Blues Suite; Vespers; Memoria; Isba; Portrait of Billie; Suite Otis; Congo Tango Palace; Bad Blood; Reflections in D; Rainbow 'Round My Shoulder; Revelations; Divining; Caverna Magica; Toccata
"Bangkok, Thailand",National Theater,Gazelle; Blues Suite; Rainbow 'Round My Shoulder; Revelations; Night Creature; Cry; Facets
"Banjaluka, Socialist Federal Republic of Yugoslavia",,Lament; The Road of the Phoebe Snow; The Prodigal Prince; Revelations; Blues Suite
"Bari, Italy",Teatro Petruzelli,Suite Otis; Landscape; The Stack-Up; Night Creature; Revelations; Cry; Come and Get the Beauty of It Hot
"Basel, Switzerland",Basel Tanzt,Cry; Bad Blood; The Stack-Up; Night Creature; Streams; Revelations; Treading; Concerto in F; Divining; Caverna Magica
"Batavia, NY, USA",Batavia High School Auditorium,Congo Tango Palace; Reflections in D; Revelations; Blues Suite; Toccata
"Baton Rouge, LA, USA","Union Theater, Louisiana State University; Louisiana State University",Feast of Ashes; Blues Suite; Streams; Carmina Burana; Revelations; Cry; Love Songs
"Beaverton, OR, USA",,Icarus; Revelations; Journey; Blues Suite; Toccata
"Bedford, NY, USA",Fox Lane High School,Revelations; Metallics; Journey; Blues Suite; Toccata
"Beijing, China",Central Ballet; Beijing Exhibition Hall,Memoria; Night Creature; Revelations; Concerto in F; Cry
"Beit Berl, Israel",,The Prodigal Prince; Reflections in D; Revelations; Blues Suite; Toccata
"Beja, Portugal",Teatro Pax Julia,The Road of the Phoebe Snow; Blues Suite; Toccata; Reflections in D
"Belgrade, Socialist Federal Republic of Yugoslavia",Atelje 212,Congo Tango Palace; Reflections in D; Metallics; The Beloved; Toccata
"Berkeley, CA, USA","Zellerbach Auditorium, University of California Berkeley; Zellerbach Auditorium, University of California Berkeley ; Wheeler Auditorium, University of California Berkeley",Masekela Langage; The Mooche; Dance for Six; District Storyville; Shards; The Road of the Phoebe Snow; Concerto in F; Pigs and Fishes; According to Eve; Liberian Suite; Reflections in D; Streams; Research; After Eden; Gazelle; Flowers; Cry; Landscape; Feast of Ashes; For 'Bird' - With Love; Tilt; Night Shade; Memoria; Precipice; Opus McShann; Icarus; Portrait of Billie; Caverna Magica; From the Mountains of Taubalu; Congo Tango Palace; Bad Blood; The River; Countdown; Inside; Revelations; Metallics; Divining; Time Out of Mind; The Prodigal Prince; Witness; The Stack-Up; Butterfly; How Long Have It Been; Tell It Like It Is; Kinetic Molpai; Quintet; Choral Dances; Fever Swamp; Fontessa and Friends; Coverage II; Later That Day; Poeme; Suite Otis; Crossword; Blood Memories; Rainbow 'Round My Shoulder; Hidden Rites; Songs Without Words; Toccata; The Still Point; Speeds; Night Creature; Missa Brevis; Blueshift; Love Songs; The Lark Ascending; Ancestral Voices; Treading; Survivors; Vespers; The Time Before the Time After (After the Time Before); Phases; Isba; Blood Burning Moon; Panambi; Hobo Sapiens; Facets; Caravan; Carmina Burana; Les Noces; Blues Suite
"Berlin, Germany",Deutsche Oper Berlin; Akademie der Künste; Theater des Westens,The Mooche; The Stack-Up; Night Creature; How Long Have It Been; Dance for Six; Kinetic Molpai; Cry; Missa Brevis; Love Songs; The Lark Ascending; The Road of the Phoebe Snow; Treading; Survivors; Vespers; For 'Bird' - With Love; Caverna Magica; Come and Get the Beauty of It Hot; Rooms; Carmina Burana; Revelations; Rainbow 'Round My Shoulder; Streams; The Magic of Katherine Dunham; Hermit Songs; Blues Suite; Toccata
"Bern, Switzerland",Stadttheater Bern,The Stack-Up; Cry; Night Creature; Revelations
"Bethlehem, PA, USA",Broughal Junior High School Auditorium,Congo Tango Palace; Reflections in D; Revelations; Blues Suite; Toccata
"Binghamton, NY, USA","Anderson Center for the Arts, State University of New York Binghamton; Harpur College Theater, State University of New York Binghamton",The Magic of Katherine Dunham
"Birmingham, AL, USA",Birmingham Music Club,Cry; Feast of Ashes; Streams; Revelations
"Bloomington, IN, USA","University Auditorium, Indiana University; University Auditorium, Indiana University ",Memoria; Suite Otis; Later That Day; Inside; Night Creature; Streams; Revelations; Clear Songs After Rain; According to Eve; Mary Lou's Mass; Flowers; Love Songs
"Bluefield, WV, USA","Ramsey Elementary School Auditorium, Bluefield State College",
"Bochum, Germany",,The Road of the Phoebe Snow; Revelations; Hermit Songs; Blues Suite; Toccata
"Bogotá, Colombia",Teatro Colon; Colonsubsidos Theater; Coliseo el Campin,Memoria; The Still Point; Phases; The River; Night Creature; Revelations; Treading; Cry
"Boone, NC, USA","Farthing Auditorium, Appalachian State University",Suite Otis; The Stack-Up; Blues Suite; Revelations
"Bordeaux, France",Palais des Sports,Suite Otis; Cry; Blues Suite; The Stack-Up; Night Creature; Revelations; Treading; Divining; Caverna Magica
"Boston, MA, USA","Metropolitan Center, Boston University; Public Gardens; John Hancock Hall, Boston University; Wang Center for the Performing Arts; Colonial Theatre; Orpheum Theater, Boston University; Music Hall",Spectrum; Masekela Langage; Journey; Dance for Six; Shards; The Road of the Phoebe Snow; Concerto in F; Nubian Lady; Pigs and Fishes; Liberian Suite; To Jose Clemente Orozco; Streams; Research; Satyriade; After Eden; Gazelle; Flowers; Anjour: Ruminations on Dudley; Cry; Landscape; Feast of Ashes; For 'Bird' - With Love; Tilt; Night Shade; Memoria; Fire Sermon; Precipice; Opus McShann; Icarus; Archipelago; Portrait of Billie; Caverna Magica; Myth; Congo Tango Palace; Bad Blood; The River; Places; Inside; Choros; Revelations; Metallics; Collage; Divining; Time Out of Mind; The Prodigal Prince; Witness; The Stack-Up; Lullaby for a Jazz Baby; Butterfly; How Long Have It Been; Tell It Like It Is; Kinetic Molpai; Choral Dances; Fever Swamp; Fontessa and Friends; Roots of the Blues; Later That Day; Sonnets; Suite Otis; Fanga; Crossword; Blood Memories; Rainbow 'Round My Shoulder; Hidden Rites; The Magic of Katherine Dunham; Songs Without Words; Toccata; The Still Point; Speeds; Night Creature; Mary Lou's Mass; Missa Brevis; Love Songs; The Lark Ascending; Treading; Survivors; Vespers; The Time Before the Time After (After the Time Before); Echoes in Blue; Phases; Isba; Hobo Sapiens; Facets; Carmina Burana; Les Noces; Blues Suite; Seven Journeys; How to Walk an Elephant
"Bratislava, Czechoslovak Socialist Republic",National Theater,Suite Otis; The Time Before the Time After (After the Time Before); Love Songs; Streams; Revelations; Tilt; Myth
"Bremen, Germany",,
"Bridgeport, CT, USA",Klein Memorial Auditorium,Icarus; Revelations; Journey; Blues Suite; Toccata
"Brisbane, Australia",Lyric Theatre,Suite Otis; Memoria; Speeds; The Stack-Up; Night Creature; Revelations; Treading; Fontessa and Friends; Concerto in F; Divining; Cry
"Brno, Czechoslovak Socialist Republic",Janáček Theater,Suite Otis; The Time Before the Time After (After the Time Before); Myth; Night Creature; Love Songs
"Brockport, NY, USA","Hartwell Auditorium, State University College of New York Brockport",
"Brooklyn, NY, USA",Bethany Methodist Church; Brooklyn Academy of Music; New York City Community College,The Prodigal Prince; Congo Tango Palace; Reflections in D; Revelations; Blues Suite; Toccata
"Brunswick, ME, USA","Gymnasium, St. Francis College; Bowdoin College",
"Brussels, Belgium","Opera House; Centre Culturel d'Uccle; Paleis Voor Schone Kunsten, Palais des Beaux-Arts",Cry; The Road of the Phoebe Snow; Blues Suite; Bad Blood; The Mooche; Reflections in D; Carmina Burana; Night Creature; Streams; Revelations; Caverna Magica; Love Songs
"Bucharest, Socialist Republic of Romania","Great Hall, Palace; Sala Palatului",Suite Otis; Gazelle; The Lark Ascending; Blues Suite; Night Creature; Carmina Burana; Rainbow 'Round My Shoulder; Revelations; Dance for Six; Cry; Toccata; Love Songs
"Budapest, Hungary",Budai Parkszinpad; Erkel Theater,Suite Otis; Fanga; Cry; The Lark Ascending; Gazelle; Carmina Burana; Night Creature; Rainbow 'Round My Shoulder; Streams; Revelations; Dance for Six; Flowers; Kinetic Molpai; Blues Suite; Missa Brevis; Tilt; Love Songs
"Buenos Aires, Argentina",Teatro Colon,Memoria; The Still Point; The Lark Ascending; Night Creature; Rainbow 'Round My Shoulder; Revelations; Treading; Concerto in F; Cry; Love Songs
"Buffalo, NY, USA","Shea's Buffalo Theatre; Woodlawn Junior High School; State University of New York Buffalo; Summer Festival of Performing Arts, University of Buffalo; Canisius High School Theater Auditorium; Artpark Theater; Niagara Community College; Kleinhans Music Hall",Gazelle; Spectrum; Witness; The Mooche; The Stack-Up; Night Creature; Mingus; Butterfly; The Beloved; Flowers; Cry; The Lark Ascending; The Road of the Phoebe Snow; Treading; Fontessa and Friends; Concerto in F; Variegations; Tilt; Fire Sermon; Memoria; Phases; Echoes in Blue; Clear Songs After Rain; Myth; Suite Otis; Liberian Suite; Three Black Kings; Bad Blood; The River; Reflections in D; Pas de Duke; Streams; Revelations; Gillespiana; Divining; Blues Suite
"Burlington, VT, USA","Flynn Theatre; Memorial Auditorium, University of Vermont",Speeds; Blues Suite; Bad Blood; The Wedding; The Stack-Up; Missa Brevis; Treading; Divining; Caverna Magica; Vespers; Love Songs
"Caesarea, Israel",Roman Amphitheater,The Prodigal Prince; The Stack-Up; Night Creature; Cry; Love Songs; Landscape; Treading; Fontessa and Friends; Concerto in F; Memoria; Pigs and Fishes; Caverna Magica; Suite Otis; Bad Blood; Reflections in D; Streams; Revelations; Satyriade; Divining; Blues Suite; Toccata
"Caltanissetta, Italy",Grad S. Francesco,Suite Otis; Treading; Night Creature; Revelations
"Cambridge, MA, USA",Ridge Tech Auditorium; Loeb Drama Center,Lament; The Road of the Phoebe Snow; Congo Tango Palace; Blues Suite; Reflections in D; Icarus; Revelations; Journey; Metallics; The Black Belt; Hermit Songs; Knoxville: Summer of 1915; Quintet; Toccata
"Cannes, France",Theatre du Fort; Grand Auditorium; Palais de Festival,Gazelle; Spectrum; Night Creature; Butterfly; Cry; Love Songs; Landscape; Treading; Concerto in F; For 'Bird' - With Love; Memoria; The Time Before the Time After (After the Time Before); Phases; Pigs and Fishes; Sonnets; Sunrise... Sunset; The River; Streams; Revelations; Blues Suite
"Carcassonne, France",Grand Theatre de la Cite,Treading; Seven Journeys; Streams; Revelations
"Carpentras, France",Theatre de Plein Air,The Stack-Up; Cry; Streams; Revelations
"Carthage, Tunisia",Theatre Romain de Carthage,The Prodigal Prince; Icarus; Streams; Revelations; Journey; Blues Suite; Toccata
"Casablanca, Morocco",Municipal Theater,Icarus; Revelations; Journey; Dance for Six; Toccata
"Catania, Italy",Theatro Metropolitan,Caverna Magica; Concerto in F; Revelations
"Cebu City, Philippines",Azner Memorial Coliseum,Mountainway Chant; Been Here and Gone; Cinco Latinos; Revelations; The Beloved
"Cedar Falls, IA, USA",University of Northern Iowa,Icarus; Streams; Revelations; Dance for Six; Flowers; Child of the Earth; Toccata
"Chapel Hill, NC, USA","Memorial Hall, University of North Carolina Chapel Hill",Masekela Langage; Icarus; Revelations; Hermit Songs; Toccata
"Charleston, SC, USA",Gaillard Municipal Auditorium,Suite Otis; Gazelle; District Storyville; Fire Sermon; Night Creature; Revelations; Streams; Butterfly; Mingus; Cry; Tilt; Myth
"Charlotte, NC, USA","Ovens Auditorium, University of North Carolina Charlotte; Ovens Auditorium, University of North Carolina Charlotte ; Coliseum; Central Piedmont Community College",The Lark Ascending; The Road of the Phoebe Snow; Feast of Ashes; Blues Suite; Icarus; Rainbow 'Round My Shoulder; Streams; Revelations; Cry; Myth
"Charlottesville, VA, USA","University Hall, University of Virginia",Revelations; Quintet; Blues Suite
"Chatham, NY, USA",Chatham Central High School,Lament; Revelations; The Beloved; Blues Suite; Toccata
"Chicago, IL, USA","Arie Crown Theater; Chicago State Teachers College; Auditorium Theater; Auditorium Theatre, Roosevelt University; Harper Theater; Civic Opera House; Civic Center for the Performing Arts; Northeastern Illinois University","Spectrum; Masekela Langage; Journey; The Black Belt; Dance for Six; My Mother, My Father; Shards; The Road of the Phoebe Snow; Concerto in F; Pigs and Fishes; Liberian Suite; Reflections in D; Streams; After Eden; Gazelle; Flowers; Cry; Landscape; Feast of Ashes; For 'Bird' - With Love; Tilt; Night Shade; Memoria; Fire Sermon; Precipice; The Wedding; Icarus; Nocturne; Portrait of Billie; Caverna Magica; From the Mountains of Taubalu; Myth; Congo Tango Palace; Bad Blood; The River; Countdown; Places; Choros; Revelations; Collage; Divining; Time Out of Mind; The Prodigal Prince; Witness; The Stack-Up; Lullaby for a Jazz Baby; Butterfly; How Long Have It Been; Choral Dances; Fever Swamp; Fontessa and Friends; Coverage II; Later That Day; Sonnets; The Blues Ain't; Suite Otis; Fanga; Crossword; Blood Memories; Rainbow 'Round My Shoulder; The Magic of Katherine Dunham; Hidden Rites; Songs Without Words; Toccata; The Still Point; Speeds; Night Creature; Mary Lou's Mass; Missa Brevis; Blueshift; Love Songs; The Lark Ascending; Treading; Survivors; Vespers; Light; The Time Before the Time After (After the Time Before); Echoes in Blue; Phases; Isba; Blood Burning Moon; Hobo Sapiens; Facets; Caravan; Carmina Burana; Les Noces; Blues Suite"
"China Lake, CA, USA",Center Theatre,Congo Tango Palace; Reflections in D; Revelations; Blues Suite; Toccata
"Christiansted, St. Croix, U.S. Virgin Islands",St. Croix Island Center,Congo Tango Palace; Reflections in D; Revelations; Blues Suite; Toccata
"Châteauvallon, France",Theatre Nationale de la Danse et de l'Image,Suite Otis; Memoria; Rainbow 'Round My Shoulder; Revelations
"Cincinnati, OH, USA",Music Hall,Liberian Suite; Blues Suite; Night Creature; Revelations; Dance for Six; Cry
"Claremont, CA, USA","Bridges Auditorium, Pomona College",
"Clearwater, FL, USA",Ruth Eckerd Hall,The Still Point; Witness; The Stack-Up; Night Creature; Journey; Cry; Love Songs; The Lark Ascending; Fever Swamp; Treading; Fontessa and Friends; Concerto in F; Survivors; Blues Suite; Vespers; Memoria; Isba; Portrait of Billie; Suite Otis; Bad Blood; Inside; Rainbow 'Round My Shoulder; Revelations; Research; Divining; Songs Without Words; Caverna Magica
"Clermont-Ferrand, France",Palais des Congres,Cry; The Stack-Up; Blues Suite; Revelations
"Cleveland, OH, USA",Ohio Theatre; State Theatre; Music Hall,Speeds; Witness; The Stack-Up; Night Creature; The Beloved; Dance for Six; Flowers; Cry; Quintet; Love Songs; The Lark Ascending; Treading; Survivors; Blues Suite; For 'Bird' - With Love; Night Shade; Memoria; Isba; Icarus; Archipelago; Portrait of Billie; Suite Otis; Bad Blood; Reflections in D; Streams; Revelations; Divining; Caverna Magica; Toccata
"Cobleskill, NY, USA","Bouck Hall Theater, State University of New York Cobleskill",Congo Tango Palace; Reflections in D; Revelations; Blues Suite; Toccata
"College Park, MD, USA","Tawes Fine Arts Theater, University of Maryland",The Road of the Phoebe Snow; Icarus; Revelations; Quintet; Toccata
"Cologne, Germany",Schauspiel Köln; Opernhaus,The Lark Ascending; Bad Blood; Carmina Burana; Rainbow 'Round My Shoulder; Streams; Revelations; Treading; The Magic of Katherine Dunham; Divining; Love Songs
"Columbia, MD, USA",Merriweather Post Pavilion,Suite Otis; Cry; The Lark Ascending; Fire Sermon; Gazelle; The Time Before the Time After (After the Time Before); Night Creature; Revelations; Rainbow 'Round My Shoulder; Butterfly; Streams; Mingus; Passage; Flowers; Blues Suite; Facets; Love Songs
"Columbia, MO, USA","Jesse Auditorium, University of Missouri; Stephens College; University of Missouri",Suite Otis; Memoria; Isba; Blues Suite; Places; Night Creature; Rainbow 'Round My Shoulder; Revelations; Butterfly; Treading; The Black Belt; Fontessa and Friends; Concerto in F; Divining; Flowers; Cry; Love Songs
"Columbia, SC, USA",Carolina Coliseum; Township Auditorium,Suite Otis; Gazelle; The Lark Ascending; The Road of the Phoebe Snow; The Time Before the Time After (After the Time Before); The River; The Stack-Up; Night Creature; Streams; Research; Revelations; Treading; Hobo Sapiens; Songs Without Words; Blues Suite; Love Songs
"Columbus, OH, USA","The Palace Theater; Ohio Theater; Mershon Auditorium, The Ohio State University",The Still Point; Speeds; The Stack-Up; Night Creature; Cry; Love Songs; Fever Swamp; Treading; Concerto in F; For 'Bird' - With Love; Night Shade; Memoria; Isba; Pigs and Fishes; Caverna Magica; Suite Otis; Bad Blood; Places; Revelations; Divining; Blues Suite
"Copenhagen, Denmark",Tivolis Koncertsal; Cirkusbygningen; Falkoner Centret,Spectrum; The Still Point; Speeds; The Stack-Up; Night Creature; Butterfly; Divining; Anjour: Ruminations on Dudley; Cry; Love Songs; Shards; Landscape; The Lark Ascending; The Road of the Phoebe Snow; Fever Swamp; Treading; Fontessa and Friends; Survivors; Concerto in F; For 'Bird' - With Love; Night Shade; Vespers; Phases; Isba; Later That Day; Pigs and Fishes; Sonnets; Portrait of Billie; Sarong Paramaribo; Come and Get the Beauty of It Hot; Suite Otis; Congo Tango Palace; Bad Blood; The River; Reflections in D; Inside; Rainbow 'Round My Shoulder; Streams; Research; Revelations; Chelsea's Bells; The Magic of Katherine Dunham; Satyriade; After Eden; Blues Suite; How to Walk an Elephant
"Cortland, NY, USA",Cortland College,
"Cotabato City, Philippines",Notre Dame Gymnasium,
"Culver, IN, USA","Culver Military Academy; Eugene C. Eppley Auditorium, Culver Military Academy",Congo Tango Palace; Reflections in D; Been Here and Gone; Cinco Latinos; Revelations; Gillespiana; The Beloved; Roots of the Blues; Blues Suite; Toccata
"Cupertino, CA, USA","Flint Center, De Anza College",Choral Dances; Streams; Revelations; Dance for Six; Flowers; Cry
